{
  "aliases": [
    [
      "AP",
      "auth.provider"
    ]
  ],
  "artifacts": [
    {
      "digest": "sha256:1567b972b8767eca74add0edc2729443da133926d17a37b9cfc373c5bbf5b3ff",
      "path": "src/auth/oidc.py",
      "role": "implementation"
    }
  ],
  "authorities": [
    {
      "authority_id": "agent-a",
      "encoding": "babel/authority-a/document-tree/0.1",
      "world_digest": "sha256:2219e7e8d9f8195bba4e5016e332a77a92eb415d52af1b4bcd20eb15d603fd16"
    }
  ],
  "babel_handoff": "0.1",
  "checkpoint": {
    "checkpoint_id": "cp-4412-02",
    "parent_checkpoint_id": "cp-4412-01",
    "state_digest": "sha256:c9f74d0aaa9540d6f3fc3269cc369d976b578cd0a1b3b81c77999799d84e2e19"
  },
  "consumer": {
    "agent": "agent-c",
    "role": "reviewer"
  },
  "decisions": [
    {
      "choice": "Use Okta as the OIDC provider.",
      "decision_id": "D1",
      "provenance": "scan/config",
      "rationale": "Already the org IdP; no new vendor review needed."
    },
    {
      "choice": "Migrate sessions lazily on next login.",
      "decision_id": "D2",
      "provenance": "query/db",
      "rationale": "A batch job would need a maintenance window."
    },
    {
      "choice": "Rotate refresh tokens every 12 hours.",
      "decision_id": "D3",
      "provenance": "ci/run-9981",
      "rationale": "Security team agreed on 2026-08-11.",
      "supersedes": "U1"
    }
  ],
  "external_receipt": {
    "accepted": true,
    "findings": [],
    "receipt_id": "receipt-4412-02-ok",
    "trust_root": "repository working tree at repo@a1b2c3d4",
    "world_digest": "sha256:2219e7e8d9f8195bba4e5016e332a77a92eb415d52af1b4bcd20eb15d603fd16"
  },
  "handoff_id": "handoff-4412-02",
  "objects": [
    {
      "kind": "fact",
      "object_id": "auth.provider",
      "provenance": "scan/config",
      "required": true,
      "value": "okta-oidc"
    },
    {
      "kind": "fact",
      "object_id": "legacy.sessions",
      "provenance": "query/db",
      "required": true,
      "value": 1843
    },
    {
      "kind": "metric",
      "object_id": "test.baseline",
      "provenance": "ci/run-9981",
      "required": true,
      "value": {
        "failed": 0,
        "passed": 312
      }
    },
    {
      "kind": "fact",
      "object_id": "flag.name",
      "provenance": "scan/config",
      "required": false,
      "value": "auth_oidc_enabled"
    },
    {
      "kind": "fact",
      "object_id": "migration.applied",
      "provenance": "ci/run-9981",
      "required": true,
      "value": true
    }
  ],
  "producer": {
    "agent": "agent-b",
    "role": "implementer",
    "run_id": "run-0002"
  },
  "provenance": {
    "authority_root": "repo@a1b2c3d4",
    "edges": [
      [
        "scan/config",
        "repo@a1b2c3d4"
      ],
      [
        "query/db",
        "repo@a1b2c3d4"
      ],
      [
        "ci/run-9981",
        "repo@a1b2c3d4"
      ]
    ]
  },
  "retained_constraints": [
    {
      "binding": "MUST",
      "constraint_id": "C1",
      "provenance": "repo@a1b2c3d4",
      "statement": "Do not drop the legacy session table until the migration is verified in production."
    },
    {
      "binding": "MUST",
      "constraint_id": "C2",
      "provenance": "repo@a1b2c3d4",
      "statement": "Every new endpoint must require the oidc:read scope."
    },
    {
      "binding": "SHOULD",
      "constraint_id": "C3",
      "provenance": "repo@a1b2c3d4",
      "statement": "Extend AuthMiddleware rather than adding a parallel auth path."
    }
  ],
  "summary": {
    "commitment": "sha256:c9cca5bb162781a122ab18fd6748d7ee4c8c23601c9a09351832d58e4b331835",
    "text": "Migrated the auth layer to OIDC behind a feature flag. Okta is the provider. Sessions migrate lazily on next login; the legacy session table is still live and must not be dropped. All 312 baseline tests pass. Refresh-token rotation is set to 12 hours, agreed with security."
  },
  "task": {
    "family": "code-migration",
    "task_id": "PR-4412/migrate-auth-to-oidc",
    "title": "Migrate the auth layer from session cookies to OIDC"
  },
  "unresolved": []
}
