{
  "aliases": [
    [
      "AP",
      "auth.provider"
    ],
    [
      "S1",
      "query/db"
    ],
    [
      "S1",
      "ci/run-9981"
    ]
  ],
  "artifacts": [
    {
      "digest": "sha256:1567b972b8767eca74add0edc2729443da133926d17a37b9cfc373c5bbf5b3ff",
      "path": "src/auth/oidc.py",
      "role": "implementation"
    }
  ],
  "babel_handoff": "0.1",
  "checkpoint": {
    "checkpoint_id": "cp-4412-02",
    "parent_checkpoint_id": "cp-4412-01",
    "state_digest": "sha256:1a88290d227b4725655545c752104abacae467a0c359b93bb92f5a7c35ec0e9c"
  },
  "consumer": {
    "agent": "agent-c",
    "role": "reviewer"
  },
  "decisions": [
    {
      "choice": "Use Okta as the OIDC provider.",
      "decision_id": "D1",
      "provenance": "scan/config",
      "rationale": "Already the org IdP; no new vendor review needed."
    },
    {
      "choice": "Migrate sessions lazily on next login.",
      "decision_id": "D2",
      "provenance": "query/db",
      "rationale": "A batch job would need a maintenance window."
    }
  ],
  "handoff_id": "handoff-4412-02",
  "objects": [
    {
      "kind": "fact",
      "object_id": "auth.provider",
      "provenance": "scan/config",
      "required": true,
      "value": "okta-oidc"
    },
    {
      "kind": "fact",
      "object_id": "legacy.sessions",
      "provenance": "S1",
      "required": true,
      "value": 1843
    },
    {
      "kind": "metric",
      "object_id": "test.baseline",
      "provenance": "ci/run-9981",
      "required": true,
      "value": {
        "failed": 0,
        "passed": 312
      }
    },
    {
      "kind": "fact",
      "object_id": "flag.name",
      "provenance": "scan/config",
      "required": false,
      "value": "auth_oidc_enabled"
    }
  ],
  "producer": {
    "agent": "agent-b",
    "role": "implementer",
    "run_id": "run-0002"
  },
  "provenance": {
    "authority_root": "repo@a1b2c3d4",
    "edges": [
      [
        "scan/config",
        "repo@a1b2c3d4"
      ],
      [
        "query/db",
        "repo@a1b2c3d4"
      ],
      [
        "ci/run-9981",
        "repo@a1b2c3d4"
      ]
    ]
  },
  "retained_constraints": [
    {
      "binding": "MUST",
      "constraint_id": "C1",
      "provenance": "repo@a1b2c3d4",
      "statement": "Do not drop the legacy session table until the migration is verified in production."
    },
    {
      "binding": "MUST",
      "constraint_id": "C2",
      "provenance": "repo@a1b2c3d4",
      "statement": "Every new endpoint must require the oidc:read scope."
    },
    {
      "binding": "SHOULD",
      "constraint_id": "C3",
      "provenance": "repo@a1b2c3d4",
      "statement": "Extend AuthMiddleware rather than adding a parallel auth path."
    }
  ],
  "task": {
    "family": "code-migration",
    "task_id": "PR-4412/migrate-auth-to-oidc",
    "title": "Migrate the auth layer from session cookies to OIDC"
  },
  "unresolved": [
    {
      "blocking": true,
      "issue_id": "U1",
      "statement": "Refresh-token rotation interval is not agreed with the security team."
    }
  ]
}
